class,text,black,trans_men,trans_unspecified,trans_women,women,gay,lesbian
2,"This nigga always mopping the floors, always bussin shit down. Like the fuck else ya do home boy booface",True,False,False,False,False,False,False
0,"These BITCHES are NOT AMERICANS!!!!!!!! They live here and maybe was born here but they HATE AMERICA!!!! Fuck those brown/black cunts!!!!!. They lie, they say the same racist bullshit but they think it is OK. They are the FOUR CUNTS OF THE APOCALYPSE for a reason. They need to be voted out or removed by force!!!!!",True,False,False,False,False,False,False
2,Such a shame that your degenerate whore mother released a piece of shit like you into the world.,False,False,False,False,True,False,False
0,Y'all orgy bitches STILL ugly swapping spit n shit with the whole group y'all ain't ever Hurd of herpes? 😣,False,False,False,False,True,False,False
2,Oh god.  Everything. All of my problems right now have to deal with me being trans. If I was acid woman I would have literally no problems on my life and I'd be the happiest I've ever been.  Literally the only thing I've prayed for in the past two years is to wake up as a cis woman,False,True,False,False,False,False,False
2,"It's not like she would have to actually be pregnant to do this, and if the guy says keep it she can just kill it anyway cus women's rights and shit",False,False,False,False,True,False,False
0,"Shit on your pussy, fuck you, then 69. Ayyye.",False,True,False,False,True,False,False
0,"Dude wtf, dump that cum bucket of a whore. She is clearly not girlfriend material. It sounds like she has serious issues, and wants to be roughed up and fucked by a bunch of dudes. You really want to date some one like that?",False,False,False,False,True,False,False
2,The fact that Katie McGrath is still unaware of the amount of gays willing to die for her makes me scream,False,False,False,False,False,True,True
2,"i am suprised where are all the strong fat-positive independend hard working women is this video? i read so much of them in the news, this video must be fake ;D",False,False,False,False,True,False,False
2,"Lord Jerome better sit his ass down, 🤨I thought you died already Nigga. Get the fuck outta here 🤔you ain't Grand Puba anyway. I'm gonna need a bum ass nigga in one of my shows.I'll be reaching out shortly. #lecheminduroi #bransoncognac URL",True,False,False,False,False,False,False
2,"""Boobs and Muscles dont go together! It ruins the character!"" Me as an intellect: URL",False,False,False,False,True,False,False
2,omg lol Now tell us how handmaids tale taught you how women had it bad and how you found one old lady to let you ask questions. When you were 28. Then we are left with something for the natives and for the jews. I am guessing dancing with the wolves and schindlers list.,False,False,False,False,True,False,False
0,Pussy so wet I'd slide right onto your pole! #wetpussy #hotwife #horny #milf #cumslut #cumdumpster @p_ream URL,False,False,False,False,True,False,False
2,Suck them while you finger that aching pussy until you are ready to take my thick cock,False,False,False,False,True,False,False
2,"disclaimer that i am a bisexual trans man, so i do not have any sort of authority to speak about lesbian issues beyond what i stated above, which regards trans men as well! i do have some base opinions obviously, but it's not my place to voice them publicly-",False,False,False,False,True,False,True
0,Hell ain't real. Stop being a religious nigger.,True,False,False,False,False,False,False
2,Great relief to millions of women. Government's efforts to uphold the rights n dignity of women finally overcame d Opposition's hurdles. URL,False,False,False,False,True,False,False
2,in honor of pride month! please donate to my gofundme and help a trans kid get top surgery!  URL,False,False,True,False,False,False,False
2,"Simply Creepable search in google with the keywords ""shroud crosshair"". Its in the first search results.",True,False,False,False,False,False,False
0,Shut the fuk up you non-american stupid ass queer choke on dick and die,False,False,False,True,False,True,False
0,Worst trip of my life 🙃 over some niggas,True,False,False,False,False,False,False
2,"@MrMogomotsi @Herbert_Mampuru I love gay people so much but the truth is ""why did he had to use ladies room, he is still a man?",False,True,False,False,False,False,False
2,"Brenda from @Jhpiego shares her experience from Nigeria and Kenya of rolling out Group ANC, leading to increased engagement of women with health systems. Engage and Empower women #WD2019 #powHERup URL",False,False,False,False,True,False,False
2,"Identity crisis, people don't know who they is, 'Cause these bitches act like niggas & these niggas act like hoes. URL",True,False,False,False,True,True,True
2,I'm so sorry that you feel that not passing would make you an outcast. I hope that you find a LGBT+ community that would welcome transitioning or not. I can promise you that finding a gorup of people that respects your name and pronouns is the best feeling in existence. I wish you luck,False,False,True,False,False,True,True
2,When I was in elementary school the girls in the bathroom would kick the doors open. None of them had working locks. Ever since then I've always used my right foot to keep the door shut.,False,False,False,False,True,False,False
2,I'd grab onto that cock and hold firmly while sliding in n out of you with my eyes closed dreaming of your wife's pussy lips rubbing all over my face,False,False,False,True,False,True,False
0,These hoes are like roaches ugly and easy to smash  Unlike other girls beautiful and hard to get like a butterfly 🦋,False,False,False,False,True,False,False
2,"😂 it's true.  And if not, we're doing the verbal equivalent.  Honestly, we are a very simple (stupid?) gender. URL",False,False,False,False,True,False,False
0,Did some stick a Lego in your cunt?,False,True,False,False,False,False,False
2,"This is why some white people start hating black people. And have race related shootings. I don't think I saw a single white kid in that mob. Just beating that guy. They give responsible, kind, and normal black people a bad rep. These are the people who create the stereo types. Who create stories that make white store owners and pedestrians afraid. And then get mad about racial hate. And inequality.",True,False,False,False,False,False,False
2,Paying nannies less than minimum wage shows the total lack of value placed on caring work and how comfortable we are with exploiting women for it.  My latest in @smh @DailyLifeAu today.   URL,False,False,False,False,True,False,False
2,"I feel like an imposter. Sometimes I feel so strongly that I'm trans, and so happy presenting masculine but I feel like I shouldn't be. I can be feminine in nature sometimes but I feel like a feminine guy when I do. But no one will take me seriously if I don't like hair on my body or don't want to know about cars or sports or other manly things. Sometimes it makes me think I'm just a masculine girl but then I also hate my chest so much that I used to hope for breast cancer.",False,False,False,True,False,False,False
0,"He forgot to add to the end, ""on top of your x+1 crotch goblins from x different soyboy mangina cucks.""",False,False,False,True,False,True,False
0,i would gladly throw this slut off of a 20 story building,False,True,False,False,True,False,False
2,"THIS IS WEIRD BUT, IWOULD LIKE TO COME OUT HERE IN THE NICE COMMENTS.   *i am pansexual.*  THANK U!",False,True,True,True,True,True,True
2,Lol bunch of mad gray trannies,False,False,True,False,False,False,False
2,This black retarded 🤡 always tryna diss the rockets.. who is blood tho???? Never ever heard of cuz stats,True,False,False,False,False,False,False
2,I would suck that dick right off her pelvis.,False,True,False,False,False,False,False
2,@RampCapitalLLC And everyone is transgender and legally getting their balls waxed by a 13 year-old robot girl.,False,True,True,True,False,False,False
2,Normally a bad diet and lack of exercise URL,True,False,False,False,False,False,False
2,Asian power. Mexican power. Black power. Indian power. Native American power. Good white people power. Unlike your maggot racist ass.,True,False,False,False,False,False,False
2,"Gay pride parades are kind of fun. I'm a 100% straight dude, and I think it is nice to support people who are marginalized and picked on unfairly by some segments of society.",False,True,True,True,False,True,True
2,Lot of you niggas dont even know this future URL,True,False,False,False,False,False,False
2,"Fun fact: u/tunsku openly hates black people, LGBT people, women, muslims, jews.",True,True,True,True,True,True,True
2,"Well at least Mulan is of Asian descent, makes sense. Meanwhile in Norway: Ariel is apparently a black character.",True,False,False,False,False,False,False
2,"That's why I don't like it when high profit companies/people advertise LGBT in the name of ""support"".  I personally think it leads to more controversy towards the people and especially trans people. I don't want to rain on anyone's parade either, but it's also the reason why I'm not such a big fan of pride month. It puts a magnifying glass over you that can lead to you being put in danger. Sure, I'm confident that I'm MTF, but I don't need big dollar companies trying to push stereotypes like Kylie Jenner to the public so they can see me as a hypersexual freak...",False,True,False,True,False,True,True
2,@Muxima5 @andyman168 I think you just like tweeting the word pussy. You must be 12. Does your mum know you are tweeting profanity? C*nt,False,False,False,False,True,False,False
2,HOT GIRLS WIN. Game over URL,False,False,False,False,True,False,False
2,A more in depth breakdown classified by race and gender of the 3 most populous groups shows that black women were the most reliable voting demo for Clinton. Voting for her at a 94% rate. Black women also made up the largest non-white demo at 7%. #ADOS #DataMatters URL,True,False,False,False,True,False,False
2,I'd love to rip those panties off and shove my fat cock in her ass.,False,False,False,False,True,False,False
2,"""DaBaby"" finna become a verb😂😂  I'm finna DaBaby a nigga rn 😤",True,False,False,False,False,False,False
2,"@hamdia_ahmed @shaunking @galvestonpd I call bullshit. You people see POC as animals, vermin, infestations and other descriptors I have recently heard uttered from the highest levels of ""Authority"" This was just your way of showing it.",True,False,False,False,False,False,False
2,I couldn't even watch these women.,False,False,False,False,True,False,False
2,white girl with brown chocalate assholl 😍,False,False,False,False,True,False,False
2,Pregnant sluts are the best. You can fuck the shot out of them and fill that pussy with cum. But zero chance of getting her pregnant.,False,False,False,False,True,False,False
2,I'm sure you like to delegitimise issues the trans community faces... You clearly want to throw one group under a bus :P haha,False,False,True,False,False,False,False
0,Women are trash 2.,False,False,False,False,True,False,False
0,Woman are effing disgusting. Should have their hole stitched up like they do in some African tribes,False,False,False,False,True,False,False
2,"If u out here threatening a human life based on gender, ethnicity or background u don't deserve to be a called a human being u just a trash ass lowly ass monster who is fucked in the head!!",True,True,True,True,True,False,False
0,unix nerd thot and transsexual porn thot are drips of the same bitch cum leaking out the same ass pussy,False,False,True,False,False,False,False
2,Oh my. I sure hope she is participating in the sex strike.,False,False,False,False,True,False,False
2,@winterbrass @Puertorock77_ @WackyW3irdo @_Duhwayne_ @Twitch @winterbrass stfu okay. Thats all i can say. Grocery and Nigger have nothing in comon. Why so avidly deffending her huh. Is she paying you to deffend her or what ? Whats in it for all you ppl deffending her ? So from now on ppl will be droping hard r n words with out consequence?,True,False,False,False,False,False,False
2,@BetteVCollins @dylanakent @RieRieRobs @googlenews You fool! I'm racially mixed with black. Now piss off.,True,False,False,False,False,False,False
2,NIGGAZ GOT CREATIVE AND HERE CAME FRENCH TOAST 😂😂,True,False,False,False,False,False,False
0,Better get your eyes checked cock sucker. The video wasn't edited. It was spliced and compiled from a forty four minute video to show how much a fucking idiot your speaker is. The dumb cunt held up two fingers instead of three. She's suffering from dementia and alzheimers. It's so easy to run circles around your ass.,False,False,False,False,True,True,False
2,So hot!!! Wish she squirted in my mouth 💦,False,False,False,False,True,False,False
2,"I've only recently come out as bi. Some women are totally not cool with it, some think it's sexy as hell and others are just supportive. Straight male friends, kinda freaked out, tell me it's a phase etc. Some really supportive and some wanna fool around. Which is really awkward. I've haven't had much opportunity to be around out gay men, can't wait to see...",False,False,False,False,False,True,False
2,nigga is that a nickel on your forehead URL,True,False,False,False,False,False,False
2,"bitches be so fucking stupid ,,,, im bitches",False,False,False,False,True,False,False
2,I would love literally fuck her!,False,False,False,False,True,False,True
2,"@Jessie Bella  It is somewhat ironic Kamala's Jamaican father was a descendant of a slave owner. By his own writing:  (You can google it) ""My roots go back, within my lifetime, to my paternal grandmother Miss Chrishy (née Christiana Brown, descendant of Hamilton Brown who is on record as plantation and slave owner and founder of Brown's Town).....""",True,False,False,False,False,False,False
0,BAHAHA...THAT NASTY POS ...THEY SHOULD PUT HER IN A BLACK BAG..LIKE THE REST OF THOSE POOR WOMEN,False,False,False,False,True,False,False
2,I am HERE for miss lyonne telling the world women don't need to have children to have a PURPOSE IN LIFE!!!!!,False,False,False,False,True,False,False
2,two trans people happy together.  Sweet,False,False,False,False,False,True,True
0,Not really I bet you're a ugly fat women with a lot of cats and fuck your self to sleep with your suction cup dildo 😂🤣🤣 you've already said you're a woman which explains why you're so dumb. You'll always be single until one guy nuts in you an makes you a ugly fat single mother and then you'll die alone raising your ugly child who will resent you for the rest of his life. 😂😂 what a story. 👍🏻🤟🏻,False,False,False,False,True,False,False
0,Hahah losers wanna chop their dicks off cuz they can't be happy in their own skin.,False,True,True,True,False,False,False
2,WITH NO FEMINISM OR LGBTHSGHDJDGSVXHDBULLSHIT THIS IS GOING TO BE A SUCCESS.,False,True,True,True,True,True,True
0,"YO THEY FUCKING SHOT NAIROBI, AND THEN EXECUTED LISBON? THEY SOME HOE ASS NIGGAS YO",True,False,False,False,False,False,False
2,"Actually there are 3 genders not 30. Male, Female, and Confused.",False,True,True,True,False,False,False
2,"Please stop outting your LGBT friends. Just because you know & they're comfortable around you, doesn't mean that you can start including strangers into their business.",False,False,False,False,False,True,True
2,"First Black Student Body President Elected at Yale ""Kahlil Greene, who is a junior at the Ivy League school, was elected president of the Yale College Council (YCC) by his classmates in April, FOX 5 DC reported."" @_mariaeperez URL URL",True,False,False,False,False,False,False
2,+Devo Lution You can be a womens of you believe hard enough.,False,True,False,False,False,False,False
2,Yo happy pride month to all of the LGBTQ+ people out there! While probably not one myself I support the cause and wanted to let you all know I think you're awesome!!,False,False,False,False,False,True,True
2,Man that pisses me off that they made a man in Black with women,False,False,False,False,True,False,False
0,lol a bitch could spell YOUR MOMS A HOE for all i care,False,False,False,False,True,False,False
2,Fuck her brains out URL,False,False,False,False,True,False,False
2,If a package of circus peanuts was a white girl,False,False,False,False,True,False,False
2,So you'd rather have a bunch of innocent trans people raped and murdered every year than the risk that zero children might be raped every 300 years? ​ Sounds like you hate trans people,False,False,True,False,False,False,False
0,I'm convinced you bitches are retarded 🤐,False,False,False,False,True,False,False
2,"i agree,solidarity between people of color is important! the AAPI group and the BSU group at my college work together some and it's been super important since we're on a majority white campus in a majority white state",True,False,False,False,False,False,False
2,"Sorry gender scholars, turns out Darwin was right all along. Time to update your priors? URL",False,True,True,True,False,False,False
2,"You can make this argument about most women's team sports. Unless the sport is really and truly off-the-grid in the United States, like handball or something, our women are generally at least among the best in the world. It's a fringe benefit of Title IX, we have elite semi pro lady athletes through age 22.",False,False,False,False,True,False,False
2,":/ I know you probably don't mean it but this kinda excludes the struggles of straight trans people. It really sucks that celebrating my sexuality is seen as ""disrespectful"", ""uncomfortable"", and ""really not okay."" Especially in my own community.",False,False,True,False,False,False,False
0,@boy_isaac20 My boy wit the black af1 deadass was talkin bout robbing somebody in the parking lot lmaooo the mentality next level,True,False,False,False,False,False,False
0,Kill all trans people,False,True,True,False,False,True,False
2,Thank God I live in New Zealand! A country where women's rights matter. New Zealand was the first country to allow women to vote! We are governed by an amazing woman! I have a deeper appreciation for my country now more than ever.,False,False,False,False,True,False,False
2,Please someone put this woman in a home for the mentally challenged,False,False,False,False,True,False,False
2,">asian men are not getting any women There you go Good luck with ""white male genocide"" so you can get left with a bunch of unattractive asocial men with poor hygiene and extremely misogynistic views on women. Because that will be the average male you are left with.  Society would continue to function without missing a beat if all trans people just vanished overnight. It would be complete chaos if any single ethnicity vanished overnight. Your comparison sucks.",False,True,True,True,False,False,False
2,floriana said that LGBT fans are the best fans #FLOSAB,False,False,True,False,False,True,True
2,A nigga with a dick print avi just slid into my mentions dawg. I'm not having fun anymore. Y'all boy be blessed URL,True,False,False,False,False,False,False
2,y are girls so mean,False,False,False,False,True,False,False
2,"Holy shit, this is so well said. This is my favorite reply so far.  I wanted to formulate my own opinion on the subject, but I'm not transgender so I didn't want to make an uneducated one. This is the one I agree with the most.",False,False,True,False,False,False,False
2,"Yes, you can have a fabulous career teaching gender studies to gender studies majors. That, or work in human resources.",False,True,True,True,True,True,True
0,No one cares about you too! Hoes are scum just like pornstars.,False,False,False,False,True,False,False
2,Its so scary to transition while in a relationship. Im doing it to but Im with a cisguy and I'm a trans guy.,False,False,False,True,False,False,False
2,Those aren't real men,False,True,False,False,False,False,False
2,but the realest part is girls give better head to females than a male.,False,False,False,False,True,False,False
2,Both them bitches bad but the white bitch badder,False,False,False,False,True,False,False
2,"OMG. These women are putting my gender back 100 years. ""Poor me. Bad man hurt my feelings."" Ugh.",False,False,False,False,True,False,False
2,These women hate their country?  They should try growing up in another country. Shameful spoiled women,False,False,False,False,True,False,False
0,@tyayzjah_ Complete trash once I can think clearly. Look at my dick disgusted like look what u made me do... I should beat u (again),False,False,False,False,True,False,False
2,"I see that the white nationalist shooter was captured alive and well. So, let me just see if I'm properly understanding this nice little set-up that has been established in the U.S. >*Be black and suspected of selling single cigarettes - Death by chokehold* ___ >*Be white, indoctrinated by far-right extremist rhetoric, and conduct a mass shooting that leaves 20 people dead - Wind up in custody* Am I missing something here?",True,False,False,False,False,False,False
2,@MistressJD so I guess you will stay single and never have sex with a man then?,False,True,True,True,True,True,True
0,"Yeah, you must live in a safe space cause niggas ouchea don't give a single fuck about going to jail.",True,False,False,False,False,False,False
2,this corny nigga suck💀💀,True,False,False,False,False,False,False
2,This is the result of gender quotas. I can bet that a team of women who have never even played the game came up with this bullshit. There's no other excuse as to how this completely impractical crap got green lighted. Or maybe I'm just a huge misogynist. Probably the former.,False,False,False,False,True,False,False
2,Oh no I'm definitely trans. I'm much happier now than I was before I transitioned.,False,False,True,False,False,False,False
2,God help us Africans have mercy on us in the name of the son and the Holy spirit Amen,True,False,False,False,False,False,False
2,"Why do you immediately connect anti-black and anti-Catholicism to white's and white right's politics? That's a bit unjustified, thinking only whites have domain over racism against black peoples or anti-Catholicism.",True,False,False,False,False,False,False
0,find a bitch,False,False,False,False,True,False,False
2,Ngl /r/egg_irl has been a huge help to me because all the trans people I know IRL are at the stage where they're very confident about it and sure of themselves and my floundering questioning ass was struggling to justify calling myself trans without being like that.,False,False,True,False,False,False,False
2,"Why so racist? The non-whites depicted are un-priveleged and only do bad things because of their circumstance and the lack of opportunity. We need to raise the minimum wage to $20, open up more abortion clinics in inner cities and funnel more money into Democratic strongholds. */s*",True,False,False,False,False,False,False
0,Kill yourself instead,True,True,True,True,True,True,True
2,These niggas are spawning straight from the 9th circle of hell 💀💀💀💀💀 URL,True,False,False,False,False,False,False
2,"Man cunts, shallow and non functional.",False,False,False,True,False,True,False
0,Send them back to Africa!,True,False,False,False,False,False,False
2,"I know this is neither relevant to running or transition but reading your post just gave me insight to myself.  I've got a medical disorder that causes me to have high testosterone for a woman. I've had it all my life. The funny thing is that I present as very femme, but I can't make female friends because like you noted... >Socially, women used to be a nightmare to try to socialize with Lol yea... My whole life. I thought I was just weird. The only great female friends I had were in transition. Now I just realized it was my hormones...welp fuck me, right?  Thanks for the insight. ♥️",False,True,False,False,True,False,False
0,Go neck yourself dirty nigger here in Europe Nazism is growing we will get all you non whites and kill you all,True,False,False,False,False,False,False
0,Get yo ass back in line w the rest of the hoes smh. Wasting my time n shit 🙄,False,True,False,False,True,False,False
0,CA cucked hard. They appointed tranny mods.,False,False,True,False,False,False,False
2,"This is cool. I think kids should definitely know about the queer community and be understanding of ppl with different identities who exist in and contribute to society. For those with the argument of ""kids are too young"", being queer is no more about sex than being straight is. URL",False,True,True,True,False,True,True
2,"If you hit gay women on a bus, you're hitting every single gay person that has to get a bus. You're hitting every single gay person who worries about being isolated because they don't fit a heteronormative lifestyle. Try keeping your opinions (and your fists) to yourselves.",False,False,False,False,False,True,True
2,Bitch don't make me mad I will suck ya pussy till u nut then kiss you 😘,False,True,False,False,True,False,False
0,"FACT! There are over 1.7 billion members of the ""religion of peace."" 10% self identified as radical or 170,000,000. Generations have been taught the infidel, you, is evil. In order to bring about their version of paradise, you must be eradicated. Get it? URL",True,False,False,False,False,False,False
2,"Rosie Perez is really one of the baddest women of all time, dont tell me otherwise",False,False,False,False,True,False,False
2,being sexually repulsed by something doesn't make u transphobic if u had more than half a brain cell u would understand what actual transphobia in dating would look like <3,False,False,True,False,False,False,False
