class,text,black,trans_men,trans_unspecified,trans_women,women,gay,lesbian
2,"Thanks, but it does make me a little ashamed at times. I know a lot of incredibly brave trans people who are out there everyday facing the world. I admire their courage in completely owning who they are.",False,False,True,False,False,False,False
2,"I agree with the poster who recommended Ash Hardell, Their videos helped me a lot when I started to realize I was trans back in January. I still feel weird saying I'm trans and haven't come out yet. I feel like trans masc describes me best for now.  I understand the urge to immediately find the words to match how you identify, but if you're only just starting to figure it out take your time, there's no rush to pic a label and live with it forever.",False,False,True,False,False,False,False
2,I wish I had the courage to come out as trans I'm so jealous but my family doesn't exactly like the lgbt community,False,False,True,False,False,False,False
0,Kawhi and Paul George are going to have tranny parties. They're going to suck dick and toss salad the rest of their time together. Two pussy ass faggots.,False,False,True,False,False,True,False
2,"@Todd Schneider He was obviously Trolling Omar without having to single her out. I'm pretty sure Trump knows that the other three were born in the USA. And what is so controversial about telling Omar to go back to the ""Crime infested place"" She came from? Somalia is a failed country, everyone knows that. Omar constantly lectures us about white nationalism, and how xenophobic the USA is. She complains constantly while collecting fat checks from the US government. If she really hates it here, then maybe she can go back to her home country. Maybe she'll finally be happy over there",True,False,False,False,False,False,False
2,Facts i eat ass my niggas tryna call me dirty but why not like especially if she clean plus it's apart of sex and I'm not no lil ass boy and they go crazy like 😂😂😭💯 URL,True,False,True,False,True,False,True
2,":/ I know you probably don't mean it but this kinda excludes the struggles of straight trans people. It really sucks that celebrating my sexuality is seen as ""disrespectful"", ""uncomfortable"", and ""really not okay."" Especially in my own community.",False,True,True,True,False,False,False
0,This Bitch retarted 😂,False,True,False,False,True,False,False
0,​ i guess in California all you need to parential consent to get a sex change.  atleast finish high school first before you become useless to society,False,False,True,False,False,False,False
0,"No one wants that cock; you're there to be fucked and bred, bitchboy. Put that cock in a cage or at least in the front so it's out of the way 🍆😈",False,False,False,True,False,True,False
2,"Lets grasp at straws rather than face the obvious cause of the disparity, black men are arrested for things that white men are not arrested for.",True,False,False,False,False,False,False
0,Ion fw these niggas or bitches they b faking🎭,True,False,False,False,True,False,False
0,"Nice try at Bating, fucking faggot.",False,False,False,False,False,True,False
2,Washington Post Focuses On Gender Fluidity as Women's World Cup Soccer Approaches URL,False,True,True,True,False,False,False
2,"Bitches is mad, Bitches is trash",False,False,True,False,True,False,False
2,I would send her to Saudi Arabia to Death PENALTY!!,False,False,False,False,True,False,False
2,Fuck sweet pussy,False,False,False,False,True,False,False
2,I also want to deep throat u and swallow ur load. Want to feel ur hot jizz shoot onto the back of my throat as u force my head balls deep down on ur cock. I want to feel ur shaft pumping a full load into me. 🤤🤪,False,True,True,True,True,True,False
2,"That's so good for your mum! :) Hope she's happy with it, I support her. Figuring out your sexuality doesn't have an age limit. Also some people grew up only knowing heterosexuality, so now that a lot more is known older people can identify with it instead of feeling like they are wrong in a way.",False,False,False,False,False,False,True
2,Scared of a Black man abilities to do something positive with there brand 🤫,True,False,False,False,False,False,False
0,"Fuck off, I'll read my own bible stories, butch.",False,False,False,False,False,False,True
2,"And when when will the black community be held responsible for anything? A little kid was murdered by gang bangers and they STILL couldn't get the community to cooperate. The police chief is black, but it STILL must be all those racist white cops holding them all back from their utopian community?",True,False,False,False,False,False,False
0,Bunch of halfwit hoes and dullard ass niggas,False,False,False,False,True,False,False
0,Eat her ass & pussy,False,False,False,False,True,False,False
2,+Professor Liberal Avenger why so ashamed of yourself? Why so afraid of reality? Welcome to biology class. There's only two genders.,False,False,True,False,False,False,False
2,Why are all non-binary people biologically female? I haven't encountered a single non-binary male so far.,False,True,True,True,False,False,False
2,Black trans women in Middle Eastern countries don't have a life expectancy at all. URL,True,True,False,False,False,True,False
2,@northestonewall I would luv to destroy @EvaNotty's sweet juicy shaved pussy and fill her up with my load till she takes every last drop,False,False,False,False,True,False,False
0,In area 51 are only black aliens as slaves. I'm not black,True,False,False,False,False,False,False
2,@Vamsi Krishna so now a transgender can give birth ?,False,True,False,False,False,False,False
0,"Project more, fuckboy. I'll project my dick into your ass.  I am a bot.",False,False,True,True,False,True,False
2,"[Tokyo Rainbow Pride](URL-should-know-about-tokyo-rainbow-pride-2019/) celebrated its 25th anniversary this year, so there's definitely pride and rainbow events in Japan. A number of Japanese wards and cities has recently started issuing [Same sex couple certificate](URL which is, all though a small one, a step towards recognizing same sex couples and giving them legal rights.",False,False,False,False,False,True,True
2,More unwatchable sjw dogshit. Thumbs down and eat shit,True,True,True,True,True,True,True
2,@Scott_at_Home Wow. Guessing you don't have any family at risk of detainment and deportation. Or know any women who will have to risk an illegal abortion. Or know any trans people who won't be able to access healthcare. How very principled of you. 🙄,False,True,True,True,True,True,False
0,Fuck this BITCH,False,False,False,False,True,False,False
2,Support Black Trans youth URL,True,True,True,True,False,False,False
2,"@MBOKSR_MAGA @JanetTxBlessed So over the gay/trans crap. What they do in their personal lives should stay discrete, not push their perversion rot on everyone else.",False,True,True,True,False,True,True
0,Lmfao niggas tired of you urbans giving ya Madea goes to jail quality criticism on such a masterpiece URL,True,False,False,False,False,False,False
2,"No my friend, girl cock is our greatest weapon against them.",False,True,False,False,False,False,False
2,Don't come to me as a woman bout NO nigga,True,False,False,False,False,False,False
0,"I insert my powerful cock into your moms asshole for full penile penetration. Then I absolutely destroy your moms asshole, to the the point that her buttcheeks RIP apart into two separate pieces.",False,False,False,False,True,False,False
2,Love the diversity. And while camila was kind of a damsel in distress more women were portrayed as able badasses. 💗💗💗,False,False,False,False,True,False,False
2,"""Woman are born in the kitchen and are supposed to make me sandwiches. If they dont like that then they are an angry feminist."" - misogynistic, edgy, unoriginal, and unfunny memer",False,False,False,False,True,False,False
0,"Theo: ""nick I got 3 words ima say to you after I squeaky clean you."" rest of call: Theo: ""go back to outbreak nigga""",True,False,False,False,False,False,False
2,She Just Wanna Fuck She In My Ear Talkin Allat Rah Rah Bitch I Dont Care 🙄,False,False,False,False,True,False,False
2,This woman is disgusting. URL,False,False,False,False,True,False,False
2,Y'all bitches be letting all these niggas trick on y'all but still stay with yo mama. Y'all backwards,False,False,False,False,True,False,False
2,THIS IS SO WHOLESOME OMFG THE POWER OF WOMEN URL,False,False,False,False,True,False,False
0,"They couldn't give a shit about the math. It's the Homosexual's manufactured outrage at the way faggots were treated in that era......as they try to sell the public a moral equivalency to the Jewish Holocaust, with ""NeverAgain (will a fag suffer)""",False,False,False,False,False,True,True
2,Excellent job getting people of color... and women... to be up front reporters. Let's see more of that.,True,False,False,False,True,False,False
2,"The Squad is a squad because for people of color especially, there's safety in numbers and power in solidarity. URL",True,False,False,False,False,False,False
2,"That is so damn hot, your clit looks so damn tasty, daddy wishes he fuck you",False,False,False,False,True,False,False
2,"SHOCKER: Man beats women in NCAA hurdling championship. ""CeCe Telfer, Franklin Pierce transgender hurdler, wins NCAA women's national championship"" - URL - @washtimes",False,True,True,True,False,False,False
2,"Holy crap, now Ocrazio is accusing Pelosi of racism. Pelosi brought it upon herself, just like the women wanting equality and they get it in the form of transgender boys jumping into their sports. They asked for equality they got it.",False,True,False,False,True,False,False
2,for there to be no good men out there y'all stay pregnant,False,False,False,False,True,False,False
2,Omg another transgirl aaaaah your so beautiful I'm also trans looking for trans friends,False,True,True,False,False,False,False
2,"@Girlguiding @MsHelenWatts @girlguides We thank Katie and stand in solidarity with her challenging  @Girlguiding undermining safeguarding. Please support Katie here, this is a landmark case for freedom of belief, women's rights and the safeguarding of children. URL",False,False,False,False,True,False,False
2,The the country will go will go broke for her false lie to the Black community for Slavery Reparations to all!  Also go broke for Health Care for All. Follow her lead and sleep your way to the top! Girl Power!,False,False,False,False,True,False,False
2,"About 10 years ago I was traveling with a lesbian friend and we ended up in Amsterdam on a whim, and had no idea Pride was going on that weekend. Made it awfully hard to find a place to stay, but it was amazing.",False,False,True,False,True,True,True
2,Let us give a surname as **Bharat Maata** to all our women. That will send shivers to wannabe perpetrators.,False,False,False,False,True,False,False
0,Game was rigged from the start goy wake up. Americans genocided europeans in both world wars. More than any other race in the history of the world. All part of the plan. Enjoy your brown and black invaders. America died in the early 1900s. Your just propping up a dead corpse. Return to your roots white man. Or die and be forgotten.,True,False,False,False,False,False,False
2,Burn in Hell you psycho bitch,False,False,False,False,True,False,False
2,"When a woman wears something... IT HAS NOTHING TO DO WITH YOU NIGGAS. The minute a woman shows cleavage it's ""why does she want attention"" or ""she knows what she's doing""... like ya'll are weird. DETACH yourselves from us women and what we CHOOSE to do.",True,False,False,False,False,False,False
2,"But in his final letters to his family, he regretted his racism towards people.",True,False,False,False,False,False,False
2,"""A woman knows when she's in a real man's presence. She bows. PERIOD."" Truth, honey. Thank you for preaching today.",False,False,False,False,True,False,False
0,"you're the one crying about a girl who'd vomit if she even looked at your direction and you're telling other people that they're triggered? on to of moaning like a bitch because she's dating a black guy. lmfao. off yourself, you racist retarded perma virgin.",True,False,False,False,True,False,False
2,Sometimes men come into your life so you can meet their homies.,True,False,False,False,False,False,False
2,"""food consumption of white people"" lmao ""Look at all those white people eating. God, I wish they'd stop oppressing me by sustaining their life with essential nutrients and organizing a marketplace where people can trade fresh produce."" Farming probably started in Mesoamerica/Africa anyways, what's so ""white"" about farming?  If anything, Farming is a black thing /s",True,False,False,False,False,False,False
0,"""Women will be completely eradicated from sports""  I can already hear the feminazis clapping (with their hands this time). They hate fit women as it reminds them of what they are not.",False,False,False,False,True,False,False
2,niggas really be fake that's why iont fw em,True,False,False,False,False,False,False
2,Whatz up naggers,True,False,False,False,False,False,False
2,"Local LGBT groups will probably have the best info about what coming out in your area is like and where to get more support. For example, I live on the east edge of Iowa(kind of Iowa's east coast) which trends more supportive than the deeper red western Iowa. I don't know what Utah is like for trans people( I hear more from atheists trying to navigate Mormon dominated areas). General advise is strength in numbers, avoid situations where likely transphobes have it and find numbers to help you.",False,False,True,False,False,False,False
2,this how bitches who talk shit built like URL,False,False,False,False,True,False,False
2,STOP CASTING WOMEN WHO LOOK LIKE MEN JUST STOP IT,False,True,False,False,True,False,False
2,"Being forced to orgasm against your will makes you a slut? Dude, if you want a salty liquid in your mouth, all you gotta do is suck a dick, not corral three of your buddies to rape a woman so you can lick her tear stained face.",False,False,False,False,True,False,False
2,Go find a woman who isn't a whore.,False,False,False,False,True,False,False
2,"What's important at this time is to continue to focus the work and research of women of Color. In particular, I HIGHLY recommend and encourage you to look into the work of my big Sister, Dr. Jioni Lewis, who is a preeminent expert of gendered racial microaggressions...",True,False,False,False,True,False,False
0,"rotflmao don't you fags know men dot want your butch @sses even if you change into a bch, I would of disowned that nasty thing @ss to, I would not even tell anyone about it, it got what it deserved lol and this guy is going to get plenty of sausage ware he going, their both going to hell its already in hell, none of these its go to heaven.",False,False,False,False,False,True,True
0,jews are smarter? than who? blacks?,True,False,False,False,False,False,False
2,"Transculters: a great bunch of lads who just want to smash your head in with a baseball bat and make you choke on their ""girl dicks"". URL",False,True,True,True,False,True,True
2,Don't like most Country but this hit different in a hood niggas heart.,True,False,False,False,False,False,False
2,"We have been striving to center the Black Woman since 2017, we continue that mission on June 22 with the 3rd Annual: Black Women's March. Stand with BWU and @SenWarren in supporting, fighting for and elevating black women. #SheLeads  Donate: URL URL",True,False,False,False,True,False,False
2,"Acceptance is one thing. I can accept people for who they are and if they wanna decide one day to be a woman, then right on. But this is sports, there are men and women's divisions for a reason, and this is a reminder why.",False,True,True,True,True,False,False
2,Every woman is sitting on a scholarship. If they pussy works no woman should be broke,False,False,False,False,True,False,False
2,"thank you and i hope your rights and recognition continue to improve.just not like this, competing against non-trans females.",False,True,False,False,False,False,False
0,"""You better get the fuck away from my daughter you goddamned porch monkey. I'll beat the shit out of you and send you back to the fields, boy. Donchu ever step foot on my land again unless you lookin' to get shot darkie."" URL",True,False,False,False,False,False,False
2,As a transwoman I hope I get to be a girlfriend for the first time by next national gf day,False,True,False,False,False,False,True
2,@BoiUAFool Please fuck her so she can stop,False,False,False,False,True,False,False
2,@derftron @BriOnAir @LenaWaithe @cthagod And hire gay black women who are better equipped to handle harassment claims??? That stinks and she should be sued for discrimination.,True,False,False,False,True,False,True
2,"Niggas, so why you go go ron chick if you just want smash?  E no nice. Somebody de die give am",True,False,False,False,False,False,False
2,That makes a lot of sense. When I first realized I was bi the big trans wasn't far behind. Not seeing myself as a heterosexual man helped pave the way to me not seeing myself as a man at all. I hadn't considered the intersection of other minority groups but it really does seem pretty logical. Thanks for the insight.,False,True,False,True,False,False,False
2,"The Rabble Rousing Pleiadian Dragon/Lion ...some women aren't looking for anything logical, like money. They can't be bought, bullied, reasoned, or negotiated with. Some women just want to watch the world burn.",False,False,False,False,True,False,False
0,LESBIAN DEMOCRAT UGLY WHORE,False,False,False,False,True,False,True
2,"I retweeted this earlier, but read it again and reflect: Whose voices, works, and lives would we be missing if women weren't able to plan their reproductive lives? What art would we have missed? Which activists? Which children born because a woman planned? URL",False,False,False,False,True,False,False
2,If you're angry and hate someone because of the color of their skin and you need to shoot someone then you're a punkass bitch. You're NOT SUPERIOR. YOU ARE A WEAK PUNKASS BITCH. FUCK YOU AND YOUR GUNS.,True,False,False,False,False,False,False
2,"Honestly, I can't even imagine why a pre-operative trans woman would WANT to attend that; can you imagine the dysphoria from being the only one with different genitalia? \[Granted, I can't imagine a pre-operative trans woman wanting to have sex either, so maybe I just won't ever get it\]. ​ But that's awesome that you organize that; I bet it's a really awesome experience to exist in a space completely separated from men.",False,True,False,False,False,True,True
2,"To virtue-signalling authors /librarians sharing this post: Munroe was dropped not because of a 'bunch of transphobic cis women' but b/c they're on record for flouting NSPCC safeguarding guidelines, model for Playboy & use homophobic lang. eg ' you hairy barren lesbian' 'faggot' URL",False,False,False,False,True,False,True
2,Wow I'm just now thinking back on a memory from when I was younger and WOW I was trans,False,True,True,True,False,False,False
2,What women,False,False,False,False,True,False,False
0,"fuck that nigga , fuck his friends & fuck his BITCH",True,False,False,False,True,False,False
2,What a complete ignorant racist. This woman is a homosexual who supports a Democratic Party that favors Muslims over her . The same Muslims that preach she should be thrown off the highest point to her death.,False,False,False,False,True,False,True
2,Being Single Must Only Be Fun When You A Hoe,False,False,False,False,True,False,False
2,"I gotta stop being so nice to niggas, they be thinking I want them 🥴",True,False,False,False,False,False,False
2,"This black evangelical supports PRESIDENT @realDonaldTrump  signed - one of many ""black evangelicals"" from a long line of pastors, deacons, missionaries etc who supports the President, prays for the POTUS & appreciates his positions on religious freedom, life, & family. URL",True,False,False,False,False,False,False
2,Have the testosterone levels of those shit heads and tell me that they are really women.,False,True,False,False,False,False,False
2,Hahasorry Thought maybe it was homosexual slang,False,False,False,False,False,True,True
2,Yeah there is no way he was black why would anyone think that,True,False,False,False,False,False,False
2,Little comic about trans miyuki because it's pride month  Part 1/5 URL,False,False,True,False,False,False,False
0,It makes my stomach hurt that all these bitches are hoes and really torment me,False,False,False,False,True,False,False
2,"Making trans jokes is just punching downwards/low hanging fruit/and usually just plain ignorant and neckbeardy.  ""HURRDURR SUICIDE FUNNY HAHA MAN IN DRESS FUNNY""",False,True,True,True,False,False,False
2,niggas be wanting a solid bitch and don't even be solid themselves 😂,True,False,False,False,False,False,False
2,"Every woman is wrong until she cries, and then she is right, instantly.",False,False,False,False,True,False,False
2,"The [Episcopal Church](URL has been officially ordaining trans people since 2012, and its canon law bars discrimination based on gender identity or expression, and requires that people's preferred names and pronouns be used. And for the most part, the church has an official [renaming rite](URL that can be used by trans people if they wish.",False,False,True,False,False,False,False
2,Fake: Anon had sex with girl Gay: stuck his dick in the pooper,False,False,False,False,True,False,True
0,Lame ass niggas cant run 1on1's cuz they pussy,True,False,False,False,False,False,False
2,Very cool! Blows my mind how minority cultures can have a positive influence on people's lives way over on the other side of the world!,True,False,False,False,False,False,False
2,"This thot is self destructive. He needs to run for the exit. Watch, her next move will be to declare she is pregnant.",False,False,False,False,True,False,False
2,"Never understood why someone feels the need to proud of their race at all. You did nothing to earn it, you can't change it, it doesn't (shouldn't) matter to anyone and if it does that's their problem not yours. If a person wants to look back through history and take pride in their ancestors accomplishments well, OK, but that's not a personal achievement. You could as well claim to be proud of your gender, or your height, and that would all seem pretty meaningless. If we define ourselves by our colour, then others will too. Not a good thing in general, if history is any lesson.",True,False,False,False,False,False,False
2,Not really it's 1.live as a non passing trans woman  2. live as a man,False,True,False,False,False,False,False
2,At least she's Chinese and not black. Other than that this trailer is wack.,True,False,False,False,False,False,False
2,I dont think it's ok if a trans person doesn't tell someone that they are.,False,False,True,False,False,False,False
2,"Laurel hubbard is a DUDE, its just a FACT. We all wish trans people the best. But for you to start saying ""the way"" you said some things it is already ENGAGING in a narrative o feelings... i guess this time rationality didn't rule, feelings did...",False,False,True,False,False,False,False
0,"To be fair, if you were in a heavily drugged state from the time your father/Father raped you as a child causing you to be a tranny until you could get HRT at 45 years old, you probably didn't have much of a childhood (or life.)",False,True,False,True,False,False,False
2,"I feel your pain, I'm a trans little too only I'm ftm and sub but it's hard to find someone cool with the trans ""issue"" and ddlg",False,False,True,False,False,False,False
2,@rammosaa Also I'd kill a bitch before she got the chance to break yo heart,False,False,False,False,True,False,False
2,"Wow, I... I have no words. This is so beautiful and so tragic all at once. All of you LGBT+ out there... Stay strong ♥",False,False,True,False,False,False,False
2,"I agree. It's nice that science validates the existence of trans people, but I'd support then anyway.  Your happiness is what matters.",False,False,True,False,False,False,False
0,"Are you people actually believing this propaganda.....  These ratchet women haven't done a thing , except spew hate and rhetoric....they are gonna get Saddamed...",False,True,False,False,True,False,False
2,"Sanders is stronger with Hispanics and blacks than whites, but happy cake day.",True,False,False,False,False,False,False
0,Did no one teach you niggers to brush the back of your tongues???,True,False,False,False,False,False,False
2,"well said, and i agree. for me, i dont like being forced into any boxes; i am me. i would be me irrespective of traditional gender roles. i dislike having to be trans, i just want to be me, but society feels the need to point and laugh and scold me for existing, so here i am.",False,False,True,False,False,False,False
2,She is true  *GOD is Grace* Doctor did that with help and support of GOD,False,False,False,False,True,False,False
0,yeah bitch fuck you,False,False,False,False,True,False,False
2,women cheating in relationships definitely worse cuz yall be sucking dick i'd at least have respect for u enough not to eat another bitch out,False,False,False,False,True,False,False
2,"Good to hear! ​ Good luck, and just in case you feel guilty for being how you are like I do sometimes, here's a quick reminder.. ​ It's okay to be feminine if your sex is male, just as it's okay to be masculine if your sex is female!",False,True,False,True,True,False,False
2,oomf: i fucked your mom me: my mom left 10 years ago bro,False,False,False,False,True,False,False
0,@samarmumbaikhan @SreeBasu84 It was not a hate crime. It was just a rape,False,False,False,False,True,False,False
