class,text,black,trans_men,trans_unspecified,trans_women,women,gay,lesbian
2,And this is why black peoples are superior! They can do practically anything and everything.,True,False,False,False,False,False,False
2,Interesting to see what businesses are honoring #PrideMonth by giving back to some #LGBTQ nonprofits. This list is from @Newsweek. URL #diversity #equity #inclusion #DEI URL,False,False,False,False,False,True,True
0,ain't talkin in love w no hoe,False,True,False,False,True,True,True
2,Female equivalent of neckbeard,False,False,False,False,True,False,False
2,Niggas will literally tell you one thing and then do the complete opposite,True,False,False,False,False,False,False
0,@jamescharles Honestly nobody gives a fuck you fake bitch,False,False,False,False,False,False,True
2,Your a young mans dream. I wish you were my mum 🙊🙊🙊 id use my very thick and hard cock to fill your mature holes and shoot my young potent seed deeply into your holes and make mummy leak and get lightheaded from just how deeply id pound her perfect pussy,False,False,False,False,True,False,False
2,"She may have been an autoandrophile, one of the girls i almost fucked was that (she wanted a dick).",False,False,True,False,False,False,False
2,il a bad bitch u cant k word me,False,False,False,False,True,False,False
2,"My parents had us attend a Presbyterian and a Methodist church growing up (switched churches when we moved towns). In the grand scheme of religion in the USA, These are two very mild denominations. In fact, Presbyterians (PCUSA) now allow for openly gay/lesbian ordained Pastors. They still have a long ways to go regarding equality and LGBTQ issues, but they are moving in the right direction.",False,False,False,False,False,True,True
0,Feminism is cancer change my mind,False,True,False,False,True,False,False
2,Read this when it came out. Love to see black women and poc talking about sex. ❤️,True,False,False,False,True,False,False
2,"Exactly..... I told my son he has more to offer.... try sports like tennis, swimming, and baseball! Stop limiting our black kids Because of how they look!! @ UpThereSomeWhereYouAreNot URL",True,False,False,False,False,False,False
0,Yal niggas gone get pregnant from all that dick riding,True,False,False,False,True,False,False
2,Thugga gotta new boy friend lol 🤣🤣,False,False,False,False,True,False,False
2,"It's a shame women, l mean white women still SUPPORT a Man who sleep with prostitutes, dodged tax, sell America to Russia. And now opening as Racist  Iran, Russia and China are United to take down US under Trump leadership .  Since America has no friends under Trump.",False,False,False,False,True,False,False
2,Much cuck so transgender bathrooms,False,False,True,False,False,False,False
2,"Team Hick stands tall for all, especially this nation's powerful, loving, unstoppable LGBTQ community. Happy #pride month. URL",False,False,False,False,False,True,True
2,@TheOfficerTatum I'm normally with you in the trans gender issue but this is a very tricky situation. She/he has an extremely rare condition. I have sympathy for her. She didn't one day decide she wanted to be a girl.,False,False,True,False,False,False,False
2,"Trans people don't need HRT to be seen as valid to others, we need it to feel comfortable in our own bodies regardless of what others think of us.",False,False,True,False,False,False,False
2,"""a woman can't be a witness"" wew can you guys smell miso soup...? i mean misogyny. URL",False,False,False,False,True,False,False
2,"@IanGule @AdequateEmily Yeah, but if you make sound during sex, it sounds like you're getting a dude off, and that would be gay",False,False,False,False,False,True,False
2,"As another trans person, you're welcome xo :)",False,False,True,False,False,False,False
2,"Went to prom with my trans best friend, who I had had a major crush on at the time. We've both moved on since then pretty much, still talk with each other quite a bit. Still get a lot of shit from one of my brothers for it.",False,False,True,False,False,False,False
2,These niggas all grown and shit,True,False,False,False,False,False,False
2,"He sounds like a great guy. If I were you I would come out to him as he seems pretty aware already that you like masculine clothing and such, maybe he already has an idea? I know of some people who identify as straight but make exceptions in situations like these. Not to get your hopes up but it still could happen, you never know. I hope everything works out well for you two.",False,True,True,True,True,True,True
0,Perhaps you could take precautions to NOT get pregnant? Why the FUCK should you get to murder a human life because you're too stupid to not get pregnant in the first place? You're alive. Why shouldn't the life inside of you have a chance of seeing the world? You cruel idiotic selfish creature. I wish every creature like you could experience the moment of abortion for the baby inside you. So you know you're a murderer. Fucking idiot.,False,False,False,False,True,False,False
2,@LT Wilson I think you are a joke for assuming and being so negative and prudish. She clearly hasn't slept with everyone and bullies like you ridiculous.,False,False,False,False,True,False,True
2,Gender Euphoria Therapy?  I can dig this.,False,False,True,False,False,False,False
2,"@AmerZahr Dear non white people like you, STFU",True,False,False,False,False,False,False
2,URL Tell me gay shit cowards,False,False,False,False,False,True,True
2,@RaquelMinkey @GovMikeHuckabee @realDonaldTrump Wholesome jokes about how women should be obedient and how killing gays is funny. I think I will pass...,False,False,False,False,True,False,False
2,trans rights! URL,False,False,True,False,False,False,False
2,"Oh no, if it isn't another black guy who thinks he's a gangster on the sub. Lets all suck his dick and jump of a suspension bridge.",True,False,False,False,False,False,False
0,"What she said was nasty and the cunt bitch herself is also fucking nasty!!! Stay out of the U.S bitch, you ain't wanted here. If people want to worship your stank ass in the U.K then so be it, fuck off!!",False,False,False,False,True,False,False
2,"That neighborhood tho, clean as hell but yeah Im starting to think very much so, especially for a black man. In America I'm starting to think women are starting to just flat out hate men for no apparent reason. Yeah anywhere overseas is gold for an American man. Hell I dont even think you have to go as far as Asia. I think Europe alone will do the trick. As long as you leave America and cross that pond it starts there. I want to try the women in the UK/ London area and then go from there. I heard women out there in the UK crave American black men and American men in general.",True,False,False,False,True,False,False
2,@maxkonnorxxx @AlexRoman95X My boi pussy needs to get fucked like this.,False,False,True,False,False,True,False
2,"The transgender argument in the context of athletic competition against real females is simply bogus. Here is a question, why is this issue mostly relevant for male-to-female transformer athletes competing against real females, but we barely hear anything about female-to-male transformer athletes competing against real males?",False,True,False,True,False,False,False
2,I need a thick and girthy nigger cock in my wet tight pussy 🥵,True,False,False,False,False,False,False
2,"As an openly gay black man back in the day, life must have had its challenges. His music is so soulful, and it hits me straight in the heart strings.",True,False,False,False,False,True,False
2,".@DrLeanaWen kicks off @modrnhealthcr's Women Leaders in Healthcare Conference. ""There is a state of emergency for women's health and public health."" #MHWomen",False,False,False,False,True,False,False
2,Hextain I really love the way you look. Cause I'm guessing you're encouraging the LGBT community?,False,False,False,False,False,True,True
2,I just fuck dis gangsta ass bitch reason why I'm reckless,True,False,False,False,False,False,False
2,Ridiculous. A mass murderer treated like he stole some $.35 gum. #BlackLivesMatter,True,False,False,False,False,False,False
2,@dhruv_rathee skin color shdnt matter,True,False,False,False,False,False,False
0,You need dicks to fuck the assholes otherwise they just shit all over everything.,False,True,True,True,True,False,False
2,How niggas drive when their girl piss them off URL,True,False,False,False,False,False,False
2,"Where is all this money, power, and privilege that my trans friends are supposed to have? Most of them are broke, kicked out, hated by their family, and don't have access to the healthcare or social support network they need. But ok, Jane Doe, keep projecting about erasure from your ivory towers built from conservative think tanks.",False,False,True,False,False,False,False
2,[rare video of Peter Buttigieg doing outreach work with African-American primary voters](URL,True,False,False,False,False,False,False
2,Black democrat killed 11 coworkers.,True,False,False,False,False,False,False
0,"Spread those fucking holes, Stupid Cunt!!!",False,False,False,False,True,False,False
2,💯 I never worried about this tho cause niggas will walk around with 70 bodies and be mad that you got 10 of them 😂 URL,True,False,False,False,False,False,False
2,"I also wish transfolk all the best and hope they find peace.  I do think there are some concerning elements, like this yaniv chick, and people shouldn't be afraid to criticize her or to ask questions about some of what's going on in the trans community. Check out r/itsafetish if you want to see a sub related to what you're wondering about at the end of your comment.",False,False,True,False,False,False,False
0,This slut needs to get rid of that pussy hair,False,False,False,False,True,False,False
0,"Zenigundam lol pussy. Your video exposes you for the fraud you are. You can't even properly light your stage. You're not messing w a 6'3"" 235 lb pro athlete. You're literally a child. Your balls haven't dropped and you can't pee straight.  Are you in nyc? Too bad. I'd invite you to my house so you can smack me up. Pol",False,True,False,False,True,False,False
2,Fake news to get people fired up. Obama administration at this time deported twice as many immigrants,True,False,False,False,False,False,False
2,it's like why b mad when i look this bad. got these niggas sad reminiscing on what they coulda had URL,True,False,False,False,False,False,False
2,I love lesbian weddings.,False,False,False,False,False,False,True
0,i don't fuck with you :) because you're a fat bitch,False,False,False,False,True,False,False
0,most emo fucking faggot i know . complete idiot,False,False,False,True,False,True,False
2,"@Richard Ralph Roehl I understand your point, you must also understand as well. She is fighting for equal rights. If you were on that situation, I am sure you would protest/fight to be treated equally. It's in our constitution, ""we are all created equal"" That's why she protests, Kneeling was never meant to be a from of disrespect, it was pruposed by a US army veteran, it's a from of respect. For those who have fought and died for our country, our flag.",False,False,False,False,True,False,False
2,Mixed asian girls are so cute you got this king!,False,False,False,False,True,False,False
2,Fuck that fat gnome cunt he's a dad he thinks he's funny but really  Alex is a fucking nigga,True,False,False,False,False,False,False
0,You are fucken ugly ugly fucken ugly girl,False,False,False,False,True,False,False
2,Transwomen retain male privilege on grounds of not having been socialized as women. They were raised as agressors and that behavior continues after transition. Transmen are generally not really included by the TRAA because they are considered women and not men.,False,True,False,False,False,False,False
2,"An entitled mum against trans people. We have dipped as a species. In all fairness, good story. You keep being you, and remember that you will always have friends to support you in your toughest times",False,True,True,True,False,False,False
0,"You look like the type of black woman that wonders why all the ""good black men"" have white women while hating your own natural beauty by doing wigs and weaves. All the while trying to establish yourself as a strong single mother of 2 that doesn't need a man. Wake up you ARE their mother all over again. Now go find you a good white boy lmao.",True,False,False,False,False,False,False
2,Vaypr 1 hop off Jon bs little dick faggot I bet uve never caught a fish in ur life. If u think that skit is funny u need mental help,False,False,False,True,False,True,False
0,Maybe they wanted her to look like a man that just transitioned. Inclusion.  They should have just gone the whole mile and made her black and walk with a limp as well as being a trans woman.,True,True,False,False,False,False,False
2,"In high heels, mini skirts n thighs phat",False,False,False,False,True,False,False
2,Some people think being a woman is like an invincibility cloak,False,False,False,False,True,False,False
2,That is the world. We are addicted to sex. The middle east tries to control it by forcing humility on the women in their dress and behavior. Other cultures like France embrace it. The US also embraces it but tries to pretend they dont.,True,True,True,True,True,False,False
2,"Rachel Chavkin ⁦@rachelchavkin⁩ not only became just 10th woman in 73 years of #TonyAwards to win a director award (for HADESTOWN), but she powerfully and fearlessly called out theater community for lack of imagination around race and gender diversity. LOVE HER. #MICDrop URL",False,False,False,False,True,False,False
2,"It's good to be comfortable in your own body! You're who you choose to be, and if you're trans that's cool and if you're cis that's cool too.",False,True,True,True,True,False,False
2,@AzieDee @eriniASTRO @LaurenMWeiss @TMTHawaii @EricaSawczynec I would not be honest if I said that as I have no affiliation with religious beliefs. Please listen to the opinions of people in the middle of a complex situation that is neither black or white. URL,True,False,False,False,False,False,False
2,Fuck me!! Start with devouring those gorgeous lips! Peel them apart gently and lick every part of her willing pussy  I'd then divert my attention to her ass before returning to her pussy to fuck her ling and deep,False,False,False,False,True,False,True
2,Tell them my brother. Anytime a nigga fucks a nigga the Naira inflates URL,True,False,False,False,False,False,False
2,"If you my nigga and you don't get mad at certain quotes n post I post u not my nigga, if you don't get jealous when a nigga try to talk to me u not my nigga, if you won't take me out in public u not my nigga🤷🏾‍♀️PERIODTT",True,False,False,False,False,False,False
0,"Shut up faggot. Like geese migrate, like boarder collies heard, like niggers rape murder and steal as an American I hate gay ass English royalty",True,False,False,False,False,True,False
2,Nothing is more sexy then watching a woman play with her pussy #like & #rt if you agree 😉 #Milf #hotwife #NGOT #realcouple #horny #cocksucker #threesomes #pussyplayingalone #sexylingerie #naughtyhotwife 😘 URL,False,False,False,False,True,False,False
2,You hear a nigga yell this at the function its time to go URL,True,False,False,False,False,False,False
0,Thats what she get for merrying a lowlife dirtbag edomite trash.....lost is justice for stabbing her black community in the back......just like tiger woods oj simpson Charles black trash Barkley and the rest of those who merry white trash women and nasty white kkk and nazi men.....i have no feelings to what happens to you for merrying outside your race.....and ill do the same if my son or daughters do the disgusting white thing....i teach mines to stay with your own rather its black latnios or native Americans....negro must stay with in the the tribes....not easu the DEVIL....,True,False,False,False,False,False,False
2,Most black americans and hispanic americans who have a large indigenous input came here way before most whites did. Just say it,True,False,False,False,False,False,False
2,Sexy dumb bitch looks like she needs some dumb cock in her,False,False,False,False,True,False,False
2,"@TopGunMovie @TomCruise Thank you for not replacing Tom Cruise with a non-binary, multi-racial alien.",False,False,True,False,False,False,False
2,I would suck that dick right off her pelvis.,False,False,True,False,False,False,False
0,Scum shouldn't be allowed have kids!,True,True,True,True,True,True,True
2,"\>username is ""AntiFemaleFederation"" \>he will go to prison and potentially get anally gang raped by big burly **black** dudes \>If a **female** lies about being raped, she should get life in prison because she can ruin the **man**'s life forever. \>False rape accusations are worse than death, rape, torture, kidnaping, and murder combined. It's the worst thing you can do to a man. \>post history is an absolute fucking train wreck i seriously hope you're trolling, dude.",True,False,False,False,True,False,False
2,"Spread your legs for me, slut. You better listen to daddy and do as you're told. Not unless you want to be punished. Fucking whore.",False,False,False,False,True,False,False
2,"URL Yeah, I do love bottoms with sizeable dicks.",False,False,False,True,False,False,False
2,"No, but it's a very important step to equality.",True,True,True,True,True,True,True
2,"Its not a ""womens issue"", its just that there is a stigma about men having it.  Personally i'm in and out of it. Not severely, but enough to have my good days and bad days.  Basically when I speak to my friends and family regardless of gender, I ask how they are doing. I'm happy to open up about my troubles, and while some have opened up, i recognise that others just dont want that yet. (And thats ok)",False,True,False,True,False,False,False
0,Then cotton picking bitch will have to be denied the superior white cock she would've gotten,True,False,False,False,False,False,False
2,Damn I can't wait to raise my black son with love and kindness.. some of you niggas need a hug,True,False,False,False,False,False,False
2,"FACT CHECK: Al Sharpton's History of Racism, Antisemitism, Anti-Police Rhetoric URL via @BreitbartNews",True,False,False,False,False,False,False
2,"+Collin Yates ..BS, I was there during his speeches..... The ones to blame are their own Tribal Chiefs in Africa that sold them into Slavery..",True,False,False,False,False,False,False
0,"I... HATE vagina feminism. Take your dumb sign saying ""ovaries before broveries"" and throw it in a big garbage fire of hell",False,False,False,False,True,False,False
2,@PrettyGirlHoe people will never be ready for this convo thoooo!!!,True,False,False,False,False,False,False
2,Purple head ugly guy girl . Shameful Shame on her. Yes I am a black American from Detroit Michigan.,False,False,True,False,False,False,False
0,I would rotate her facing that mirror. Unfasten that big bra.. Bend her over That counter... Put her panties aside.. And fuck her while I whisper in her ear what a little whore she is... And that I love to see those boobs bouncing. Then I would pound her harder and harder. Would love to finish in her butthole once she has cummed...,False,False,False,False,True,False,False
0,You can't turn a hoe into a house wife hoes don't act right  -Luda,False,False,False,False,True,False,False
2,"dating in Houston has been a solid 7/10. All the guys I've been out with have been country gentleman for the most part. The outliers are the really tall bearded niggas that are man whores and the 5'9"" niggas who are a 5'9"" lie. 🧐",True,False,False,False,False,False,False
2,A rich black man lives ten times better than a poor white man. People respect money its never been about race. If black people were all filthy rich we'd worship them.,True,False,False,False,False,False,False
2,BLAKBODHISATTVA lol Europeans aren't the ones complaining and asking for reparations for people who have never been slaves. Also side note blacks sold blacks into slavery and slavery is still a problem in Africa. I think blacks who want to complain should go back and if not let them see that out of something horrible their lives have been bettered,True,False,False,False,False,False,False
2,Dope that he had an epiphany about African culture 🌍✊🏾,True,False,False,False,False,False,False
2,If anything the fact that he threatened to shoot me in the head for calling him a faggot makes him a fragile white redditor,False,False,False,True,False,False,False
2,As a slightly feminine top I appreciate all masc bottoms that enjoy a dude like me,False,False,False,False,False,True,False
2,"@CheryLipsssss @Abel_Nkosinathy This is the Feminism women should be preaching, this is exactly that STRENGTH women have that they are still too blind to see. Women can actually control the world... They don't need to compete with men to it. I love your ideas",False,False,False,False,True,False,False
2,"They also project their own feelings and experiences onto others, thinking that they've been brainwashed and every trans person will eventually go down the same route they did.",False,False,True,False,False,False,False
2,"""there probably just weren't any qualified women for the job"" URL",False,False,False,False,True,False,False
2,"@BlindFury_5428 @Jackabug @Shelducks8 @glasgowpaddy @nicolacoughlan Personally, I happily supported the notion that transwomen are women & transmen are men. I believe in mutual tolerance & understanding. Politically can no longer do that. It all changed when recently males self iding as women moved to colonise our language & single sex spaces.",False,False,False,True,False,False,False
0,The only way to breed a dumb whore is by pounding deep on her little pussy. URL,False,False,False,False,True,False,False
0,"@PsychoMetalHed You Stupid bastard, maybe you will wake up one day, living under a bridge, next to a gay, drunk, drug using, Iranian that hate every American regardless of color, in the winter, while it's snows, in record cold. Then you may realize just how stupid you are/were.",True,True,True,True,True,True,True
0,Fucking bitch makes me sick. She has the nerve to message me and says me too. She would say SHIT if I was in front of her ready to smack the lips off her fucking face for her disrespectful whore fucking attitude.  I can smell her filthy stink through the fucking phone and I'm offended that she keeps wasting oxygen that would be better used on someone else.,False,False,False,False,True,False,False
2,A young white girl will face 2 black cocks at same time!! 😝😛 #interracial #bigblackcocks #snowbunny #dp #bbcslut #whitegirl #teen URL,False,False,False,False,True,False,False
2,"Thank you all for your encouraging comments. The pain of years of rejection coupled with rejection of my feminine self and the constant negativity and homophobia and transphobia got to be too much. So for the time being I'm retreating as deep in the closet as I can possibly go, and the dysphoria is as real as the tears running down my cheeks.  I love you all. Charli",False,True,False,False,True,False,True
2,"As #PrideMonth starts, remember that 50 yrs ago the Stonewall Inn was raided by police giving rise to the Stonewall riots. This is how the lgbtq movement began & our rights are still under attack. Don't stop fighting for equality even if the rights you fight for are not your own. URL",False,False,False,False,False,True,True
2,"Congrats, niij. I'm a native trans guy myself and am always afraid if mixing with my people because customs and ceremonies can be so gendered. I'm glad your tribe is setting a good example. And congrats on graduating! Ahow!",False,False,False,True,False,False,False
0,Oliver Phippen your buddy Don raped a thirteen year-old girl and brags about grabbing women without consent you racist piece of trash,False,False,False,False,True,False,False
2,Niggas look for you where they last buried you.  It's the 3rd day ....I'm long gone!,True,False,False,False,False,False,False
0,"Blacks back it again. Honestly I'm not even surprised, they should be sent back to ooga booga primitive Africa",True,False,False,False,False,False,False
2,Would love to play with that dirty whore. I'll make her put her thong in her mouth while i fuck her.,False,False,False,False,True,False,False
2,Shut Up! She Cant Make Babies! Have Some Class,False,True,True,False,False,False,False
2,"Happy Pride Month!! This Pride Month, anyone can help the LGBT+ community directly by buying Lotus Zine here: URL. All proceeds go to @chennaipride, an all-volunteer collective of LGBTQIA+ people in Southern India devoted to serving the local community. URL",False,True,False,True,False,True,True
0,"Jesus Christ was a hippy socialist pussy wino beta cuck snowflake homo libtard SJW crybaby... ..or at least that's what Trump Voters and the GOP would be calling Him if He were alive today. Through the bars of his cell, of course. On Death Row. By experimental lethal injection. URL",False,True,True,True,False,True,False
0,"Fucking Feminists and bitch ass Lezbeeyuhnz are ruining all the great movies, Now we have Batwoman, Supergirl, Madmax, Ghostbusters, C.Marvel, and now this piece of SHIT. IT'S FUCKING ENOUGH THOTS.",False,False,False,False,True,False,False
0,They really kicked that 12 year old out? Man fuck those liberal cock suckers. Hillary supporting lesbian pieces of shit. Believing in more than 2 genders stupid ass freak,False,False,True,False,True,False,True
2,Not to take away from her as she did amazing. But there has been quite a few black opera singers brfore.,True,False,False,False,False,False,False
2,@kingbsmithh @Iieutbenson this isn't a threesome back out bitch,False,False,False,False,True,False,False
