class,text,black,trans_men,trans_unspecified,trans_women,women,gay,lesbian
2,ENG version of the thread from yesterday. It's not about my decision of playing pro - it's about the current state of w soccer worldwide and the decisions that we (female players) need to make in order to find equal opps. There's only one rival here: GENDER INEQUALITY (1/10) URL,False,False,False,False,True,False,False
2,We support trans people here,False,True,True,True,False,False,False
2,@AlexMorris826 @L0soJr tell him everyone on twitter says he a white lil bitch and to stop saying the n word,False,False,False,False,True,False,False
0,Fuck that nigga that you love so bad URL,True,False,False,False,False,False,False
2,Fuck that bitch.,False,False,False,False,True,False,False
0,@CAF_Online Dirty negros bastards piece of shit,True,False,False,False,False,False,False
2,Nah i'm never gonna worship a fuckin woman,False,False,False,False,True,False,False
2,niggas about to plant a forest just off me URL,True,False,False,False,False,False,False
2,all girls and ladies are beautiful and talented. all men and boys are handsome and talented. Congratulations,False,True,False,True,True,False,False
2,"The ""send her back"" chant was foul (though not illegal or even hateful and not particularly racist as it applies to anyone who plots and schemes to overthrow the nation regardless of melanin content). Trump left it as her choice. The crowd's speech ""required"" it -- and let's remember ""The Squad"" are the authoritarians here. People oppose her because she stands against Liberty and the core tenets of Western Society. It would have been wise for Trump to stop the chant and point this out so he would have had the image of holding the high[er] moral ground.",True,False,False,False,False,False,False
2,"""I have been a lesbian all my life, for eighty-two years, and I am proud of myself and my people. I would like all my people to be free in this world, my gay people and my black people."" — Mabel Hampton #blackwomenradicals #BlackDiasporaPride #PrideMonth URL",False,False,False,False,False,True,True
0,"Yeah you like that, hope you're choking on my cock and moaning all around it as I abuse your tiny asshole",False,False,False,False,True,False,False
2,"Yes, ""unproblematic"" as in ""I'm the sort of person who is constantly labelling people and things as 'problematic' but not in this case"". Sounds like the kind of person who complains about white voice actors playing POC or asks why none of the main characters are black in a movie about Norse mythology.",True,False,False,False,False,False,False
2,I feel like this could go mtf AND ftm purely bc of Trans Power™ and the Power of Respect for our Fellow 'Fugitives'™,False,True,False,True,False,False,False
2,"Only ones who will be attending are, liberals, lesbians and transgender qweers. Womens soccer or shall I say any women's sport is just as boring as watching paint dry.",False,True,False,False,True,False,True
2,"If it means what I think it means (not from the US, not English speaking) it's both a) racist against non-whites because it implies that non-whites are trash by default and b) class discrimination against low status people.",True,False,False,False,False,False,False
2,I'd force that clit to cum hard from a sissygasm from me pounding you senseless,False,False,False,False,True,False,False
2,She deserves the utmost respect. What she's doing for the Black Community is exceptional. Using her power and privilege the right way.,False,False,False,False,True,False,False
2,"I love this this bit of your post ""Pick your moment. Don't feel pressured, you can have a closeted life if you prefer. "" ​ I think it is due to society being so pushy now with people coming out and being accepted; however, I think that much of society, myself included, fail to see that coming out may actually have a drastic life-altering effect on the person which may result in a negative outlook.",False,False,False,False,False,True,True
2,PLEASE RT - BLACK TRANS WOMAN IN CRISIS. PLEASE HELP WITH WHATEVER YOU CAN. URL,True,True,False,False,False,False,False
2,I lived life as a girl for 2 years. Stopped for many more since I had to move and recently came out as trans and pretty soon I'll be living life as a girl again.,False,True,False,False,False,False,False
0,"Lmao at your pathetic ass after touring your profile. You're a tranny, go ahead and blow your brains out, stop wasting our time and go see Satan.",False,False,True,False,False,False,False
2,Niggas think everything is gay because they're hiding something inside.,True,False,False,False,False,True,False
2,you see this fictional character? i'm not afraid to admit that i've lost liters of cum to this character of mere fantasy. isn't it funny how not even real women arouse me like she does? i have killed millions of my offspring to the thought of having an intercourse with a cartoon URL,False,False,False,False,True,False,False
2,Hecc off with your sexist bs,False,False,False,False,True,False,False
0,You indignant cunt. Fuck this chick.,False,False,False,False,True,False,False
2,"Society: She's pretty, I bet she's a conceited bitch.  Also society: He is an asshole, but he's good looking so we'll let it slide.",False,False,False,False,True,False,False
2,"Yes of course women sport particularly, there's some trans super women breaking records lately.",False,True,False,False,False,False,False
2,Bye Felicia I'd be no Fucking use to you nor would King Kong to your pussy after insertion of that baseball bat,False,False,False,False,True,False,False
2,"I want to caress your moms big black breasts. Then slowly rub my chenky dick next to it. Then after cut opeen the titties as she screams for me to go harder, and then extract the chocolate milk out dem ttitties.",True,False,False,False,True,False,False
2,"'This Is Us': In Wake of El Paso, Eddie Glaude Delivers 'Incredibly Powerful' Statement on US History of Racism and Violence—And You Can't Just Blame Trump - URL via @commondreams #ACountryInTrauma",True,False,False,False,False,False,False
2,"With all the alternatives today, and seeing how women act... It is crazy. They act like a kid staying up past his bedtime. They try to push the limits and see what they can get away with.",False,False,False,False,True,False,False
0,My god those niggers are worse than faggots.,True,False,False,False,False,True,False
0,That bitch epitomizes trash,False,False,False,False,True,False,False
2,"Great women, I can see how insecure men could be intimidated by them. I find them amazing and inspiring.",False,False,False,False,True,False,False
2,"Equality, freedom, and human rights.It is such a beautiful things.",True,True,True,True,True,True,True
2,@da_realgmoney @1YUNGFRESH Live how I wanna live. Real niggas in this bitch 4Real 💪🏾,True,False,False,False,False,False,False
2,"This is what google shows you when you type in ""bitter, frustrated lesbian""",False,False,False,False,True,False,True
2,"So it's man, or not a man",False,True,True,True,False,True,True
2,"I felt the same way growing up as a man. I imagined myself having long red hair (I'm a brunette) and being a girl. Once I got to college, I realized nothing was stopping me. You are perfectly valid regardless of where this goes. I recommend going to r/lgbt if you would like more advice. You're not alone.",False,False,False,True,False,False,False
2,"Everyone is welcome to celebrate how far we've come in terms of accepting marginalized groups. Whether you're part of one or not, Bring your positive vibes and we'll have a blast together. ^^^inb4 ^^^police ^^^in ^^^uniform ^^^comment",True,True,True,True,False,True,True
2,She did a bright eye tutorial and she has Goldfrapp's Black Cherry playing through it and it is so relaxing.,False,False,False,True,True,False,False
2,niggas will say they dont approve of gay people on tik tok live then come on here and say fat uwu life is crazy URL,True,False,False,False,False,False,False
2,"I would agree that it's about sharing culture. I specifically go to a clinic for gay people run by gay nurses, doctors, and other staff. Makes talking about my personal health so much easier, because I'm around people that understand and know information that straight doctors might not know about, simply because they don't live as a gay person. And the doctors really care because they are directly influencing and affecting their community.",False,False,False,False,False,True,True
2,Sometimes I wish I was an androgynous Korean pop singer,False,False,True,False,False,False,False
2,I am kinda sorta in love a little with Michelle Hendley. This is a COMEDY about a lesbian trans woman who makes video games. No trauma porn. No victimization. No trans sex worker.  I wanna see this.  THE MORE THINGS CHANGE URL,False,True,False,False,False,False,True
2,"I am from India. Thanks for keeping that Karen ass back in your home town. You guys have a happy, cheerful and Karen free vacation.",False,False,True,True,False,False,False
2,"They never backed up the statement "" trump has told congresswoman of color to fixed the crime infested place they came from""",True,False,False,False,False,False,False
2,Fake ass nigga u ain't realer than my junkie,True,False,False,False,False,False,False
2,"Cool. Again, thank you. For my part, i'll make sure to emphasize that stuff more when I'm talking about Bernie and racial issues, or when I go door to door in black communities canvassing.",True,False,False,False,False,False,False
2,"There is a trucking youtuber out there who is a woman now, but used to be a man but is now a lesbian.",False,True,False,False,False,False,True
0,+Soy Latte Right? these cunts need to be extradited to Siberia,False,False,False,False,True,False,False
2,"Not to seem racist, but I love girls with pretty faces.",False,False,False,False,True,False,False
2,"I consider it a health condition, which has my sympathy. I can't imagine what it would be like to wish more than anything to be born the opposite sex. That has to be difficult, even though it's not in itself life threatening like cancer or a disability like blindness. This is only my speculation, but I think people generally would have a more sympathetic view of issues facing trans people if the public discourse was from a health standpoint rather than a sharply political one.",False,True,True,True,False,False,False
2,Marielle Franco was a bisexual human rights defender in Brazil. She was murdered in March 2018 in retaliation for daring to speak out for rights and social justice.  We march for her. #WorldPride #MADREspeaksLGBT URL,False,False,False,False,True,True,True
2,Really like how they make her look like the whore she is,False,False,False,False,True,False,False
0,Eat dick and die bitch xD go cry somewhere else,False,False,False,False,True,False,False
2,Fellow trans girl here! Love and support confirmed!,False,True,False,False,False,False,False
0,She doesnt even have tits uno u could class her as a men URL,False,False,False,False,True,False,False
0,Niggas suck more dick then these bitches,True,False,False,False,False,False,False
2,"Smh I thought women, children, women with children, and pregnant women were off limits. The streets just don't give af no more URL",False,False,False,False,True,False,False
2,"New trending GIF tagged lgbt, pride, type, lgbtqia, pride connects us via Giphy URL September 9, 2016 at 09:46AM this is an automatic spam message URL",False,True,True,True,False,False,False
0,Why do so many 15 year old american girls look like this? Inbreeding?,False,False,False,False,True,False,False
2,Don't let a woman shrivel your manhood,False,False,False,False,True,False,False
2,"@blaise gordon  Yeah! That too. Asians, Latinos and white COLORED people are fed up with black privileges and entitlements. A race war, at least in some sectors of the United States, is a definite possibility.",True,False,False,False,False,False,False
0,Stop reposting faggot,False,False,False,False,False,True,True
2,"TAL -  81 words, about the struggle to get homosexuality removed from the American Psychiatric Association's list of mental disorders.  My Pen Pal, which features a fascinating story about a pre-teen American girl becoming pen pals and eventually 'friends' with Manuel Noriega.  Fiasco is great, too.",False,False,False,False,False,True,True
2,">The left only cares when it's not whites dying. They do? 73 people were shot in Chicago in the past week. 98% of them either black or hispanic.  The only time they care, is when they can blame the white man. Because they sure as hell don't give a fuck when dozens of minorities are shot by another minority in their cities.",True,False,False,False,False,False,False
0,these black women are vile and need to leave this country and stop giving us diseases!,True,False,False,False,False,False,False
2,"it is sad but she's a idiot to get knocked up. unless she's been living under a rock the past 12-13yrs she had to know the very real consequences of her actions. she's needlessly burdened herself, possibly her parents and most likely the tax paying public who didn't sign up to support her endeavor",False,False,False,False,True,False,False
0,Fuck this chick,False,False,False,False,True,False,False
2,"What a faggot. He probably thinks he looks good in that orange wife beater so he created this ""goofy funny video"" to show off to the four chicks that follow him. As if halfheartedly dancing to Britney Spears is some epically relevant dis to a 90's pop star.",False,False,False,False,False,True,True
0,"With all the Birth control method s what Stupid women we have wanting murder,ABORTIONS R women that Stupid or just lazy Hateful Murderors Wow Brainwashed for EVIL False lyin teachers ,Preachers of Satan o Yea Brainwashed stupid.",False,False,False,False,True,False,False
2,mmmm would grope those tits as she sucks my throbbing cock in front of you,False,False,False,False,True,False,False
0,god damn black people bitching about... being enslaved,True,False,False,False,False,False,False
2,"people talk about equal rights for men and women but they forget that white women still have more rights than black men, it's a much deeper conversation that people seem to forget while white women are fighting for equal payment, black women are still fighting for an education URL",True,False,False,False,True,False,False
0,Id beat that bootyhole down babygirl,False,False,False,False,True,False,False
2,"The only black girl I've slept with, that bitch gave me GW.",True,False,False,False,True,False,False
2,One of my best friends that I live with is black and I can attest to how true this is lmao!! Amazing content.,True,False,False,False,False,False,False
2,"@Opinion8dKellie That's so so so true. Many people outside the black race aren't aware of this. Thank you for saying so. You nailed it, girlfriend. You nailed it!",True,False,False,False,False,False,False
2,"#जीवन_आशा_मुहिम Even today a young widow has to face social stigma. Wearing white clothes, facing boycott, etc. are common problems. To fight this social evil, initiative to promote widow marriages has been launched by Saint Dr. Gurmeet Ram Rahim Singh Ji Insan @Gurmeetramrahim",False,False,False,False,True,False,False
2,"I think I like being called a girl because I always feel bad that I didn't get to be a girl growing up. I don't know if I can say that I would trade my male upbringing for a female upbringing, I don't know what that would entail, or if that would be more harmful than beneficial. But I do know that it makes me feel very dysphoric thinking about all the years that everybody treated me as a boy. I mean, they still do. I haven't had HRT _yet_. But still.",False,True,False,False,False,False,False
2,@shanexxxdiesel IS LEGEND! #interracial #bbclovers #myblackbffucksbetterthanyourwhitebf @jaelynfoxxx's pussy = #destroyed yet another #whitebitchsatisfied #pornisart URL,False,False,False,False,True,False,False
0,fuck that ho and fuck your kids too,False,False,False,False,True,False,False
2,"Um, Hamas Tlaib you and the Suad promote and incite violence basically on a daily basis. You and your trashy mouth need to be removed from government period. You are a cancer! URL",True,False,False,False,False,False,False
2,Women are scum😨😨  URL,False,True,False,False,True,False,False
2,@moonythejedi394 am trans masc enby. if you get a few ppl to consult to consult it'd be fine. there's a bunch of trans masc folk in this fandom!,False,False,False,True,False,False,False
2,"you dumb fucks always saying ""i wish hispanics and black people got along 😍😍"" then continue to say the n word and say racist shit anytime you get the chance",True,False,False,False,False,False,False
2,>Just look at what female birth control does to women Does what? Either way they'd still be foids.,False,False,False,False,True,False,False
0,this bitch is grade a retarded,False,False,False,False,True,False,False
2,Fun fact: Only respecting women that you're attracted to isn't respecting women.,False,False,False,False,True,False,False
2,Oh for Pete's sake through the country under the bus and just vote in a black woman whether she is qualified or not,True,False,False,False,True,False,False
2,ain't no way in hell I'll have a baby by a nigga that don't even take care his first one !,True,False,False,False,False,False,False
2,"Interesting so, we only oppose state racism when its affecting someone we like or agree with, when that same stage racism victimises someone we disagree with, were more than happy to co-sign that shit. Is it any wonder that racism continues to thrive?",True,False,False,False,False,False,False
2,The gay neega has too many tats,True,False,False,False,False,True,False
2,I love this woman. What a historic female Patriot to this country.,False,False,False,False,True,False,False
2,"That grotesque image of a woman is a demonic entity arisen to undermine all Western Civilization, along with her 3 demonic cohorts.",False,False,False,False,True,False,False
0,What do you expect from tranny extremists?  There double crazy.,False,False,True,False,False,True,True
0,@Jay Patel lol fuck t series you skinny Indian twat,False,False,False,False,True,False,False
0,She's a useless cunt.,False,False,False,False,True,False,False
2,I don't know if this would be considered offensive or not but I find it so interesting that a black person has a southern type of accent. I definitely never see that where I live and I find it so cool.,True,False,False,False,False,False,False
0,This trash should be CASTRATED AND mail to Nile to crocodiles,True,False,False,False,False,False,False
2,This is Doug. Doug loves you...all of you. Doug supports #lgbt #lgbtq #furends and strangers equally and hope you do as well. Doug would like to see how you are observing #pridemonth and #pride every month. Doug is a… URL,False,False,False,False,False,True,True
2,bos blondes with porn sex toys sauna amatoriale amature fucked sexy colle ge brunette fucked amature xxx amatuer wife orgy home pics naked lesbians first time amateurs ass hot blonde fuck american blonde b URL,False,False,False,False,False,False,True
2,"Um if a penis is triggering the deeper fears of the human mind, probably penis isn't for you.",False,False,True,True,True,False,True
2,>I'm under the impression there's a bit of an anti-trans resurgence happening in the UK right now. I would think the value of a trans person having the opportunity to speak for themselves in public outweighs this ill-defined risk. I've edited and included the video in the OP so that you can see and judge for yourself. What do you think now that you've seen it? Should I consider it that problematic?,False,False,True,False,False,False,False
2,Girls who pee like this have da best pussy URL,False,False,False,False,True,False,False
2,(37) my dad is black and my mom is from a white dad and Indian mom so mixed,True,False,False,False,False,False,False
0,"i would go down on that pussy and make it so so wet she would be begging for a cock in side her ,,I would then have her suck my cock while looking you straight in the eyes ,,when' iv had enough of that, I will fuck her pussy so hard she will have to suck your cock to stop herself from screaming ,then I will creampie that pussy  ,now its your turn to fuck that wet hot creamy pussy and hey after you fill her with your cum, i might even have another turn after you ,,",False,False,False,False,True,False,False
2,"Your mom is Somali, your dad is Somali, hence you're a full blooded Somali Farah. That's it. Don't open that pandora box bro.",True,False,False,False,False,False,False
2,Eat my pussy from the back bitch,False,True,False,True,True,False,False
2,"Yeah, I know. Thanks for reassuring me, though. I don't really mind if anyone doesn't support it. It DOES seem kind of wack from a non-trans perspective if you don't know the science behind it. And, yeah, they should be separate. Like you said, the struggles are completely different. The LGB-T slogan is ""Love is Love"" but I feel that as a transguy that doesn't resonate with me because I'm straight and don't face discrimination for my sexuality.",False,False,False,True,False,True,False
2,I don't see how it relates but... fuck yeah trans rights,False,False,True,False,False,False,False
2,"My boyfriend used to work in Hollywood Studios. While waiting in line for ToT a cast member stopped us and talked to my boyfriend for a little bit... Then she told us that we didn't have to wait in line and gave us fastpasses ( the wait was ~120 minutes). I really wanted to give her a hug.  Not really an ""experience"" but there's a trans bellhop and whenever I see her it makes me smile and appreciate the fact that Disney is 100% fine with trans people, and that the world in general is more accepting of LGBT+ individuals. Apparently she's a really nice person too.",False,True,False,False,False,False,False
2,this nigga a 🐶 fr,True,False,False,False,False,False,False
0,This stupid ass tranny teacher should be thrown in prison for brainwashing children about a lifestyle that too often tragically ends in suicide. #LGBT URL,False,False,True,False,False,False,False
0,Fembot TLGBT function - Eliminate all Alpha males and induce soy consumption.,False,False,True,False,True,True,True
2,"""Women have recently lost the privilege of being alone with men. That's something they honestly don't deserve, and something they'll need to earn again. We don't have the leisure of worrying about their lack of opportunities. Our lives and well being come first.""",False,False,False,False,True,False,False
2,Embrace this dick in her ass. She's the anal type,False,False,False,False,True,False,False
2,so excited to have children and worry about them being slaughtered at school by a white supremacist,True,False,False,False,False,False,False
2,"White guys with guns have been running the show for a long time. 243 years to be exact & look where we're at. Imagine if we banned men from owning guns. All men. Suicides, homicides & mass shooting deaths would immediately & significantly decrease.  Imagine that. @shannonrwatts",False,True,True,True,True,False,False
2,@zackloranclark Not even gay but I want this movie because so many awesome women in history get completely ignored.,False,False,False,False,True,False,False
2,Looks like you couldn't get either dumb nazi bitch URL,False,False,False,False,True,False,False
2,Girls who fight the other woman instead of their cheating boyfriend are landfill trash,False,False,False,False,True,False,False
2,"I think freedom of religion is great, I think breaking gender roles is great, I think freedom of speech/self expression is great, I think economic migration can be a good thing and I think, simply put, that everyone should have equal rights upon birth.",False,True,True,True,True,False,False
2,You think black persons are animals you piece of filth racist??,True,False,False,False,False,False,False
0,At US-Canada border Yeah we can't let you in sir says here in your passport that you are proper FUCKED in the head.  But... but... my gender identity. Yeah we don't pander to that fairy tale bullshit when it comes to the security of our country. If you didn't notice a real man runs this country and has a set to stand up for what is truth and what really matters. REEEEEEEEEEEEEEEEEEEEEEEEEEEEEEEEEEEEEEEEEEEEEEE,False,True,True,True,False,False,False
2,Any day now all the blacks will start going back to Africa to escape police brutality...,True,False,False,False,False,False,False
2,@scorpionpoiison How I be feeling knowing that us black fans be the ones coming with the most jokes and hype. Like I'm proud asf to be black and a fan of these groups. URL,True,False,False,False,False,False,False
2,Ieen never had shit but I can fuck a bad bitch,False,False,False,False,True,False,False
0,"if a nigga make a flipagram video about a girl i'm wit just cuz that's his ex and he miss her, i hope he willing to die for that pussy fr",True,False,False,False,False,False,False
2,"You don't have the heart to go up to black people IRL and start slinging the N-word without your keyboard to protect you, but i'll let you keep ""rationalizing"" this little pet theory of yours.",True,False,False,False,False,False,False
2,"Diop Reflects On Being 1st Black Woman Director In Competition At Cannes Film Fest: Mati Diop was initially disappointed when she, by reading a news article, discovered that she was the first black female filmmaker in the Cannes Film Festival's… URL URL",True,False,False,False,True,False,False
2,linde. dont fuck my wife or i'll fuck yours back,False,False,False,False,True,False,False
2,"this nigga just called macaroni and cheese ""the white man's diet"" LMAOOOOOOOO y'all are weird.",True,False,False,False,False,False,False
